shrivatsa@shrivatsa-Victus-by-HP-Laptop-16-e0xxx:~$ sudo mysql -u root -p
[sudo] password for shrivatsa: 
Enter password: 
Welcome to the MySQL monitor.  Commands end with ; or \g.
Your MySQL connection id is 9
Server version: 8.0.33-0ubuntu0.22.04.2 (Ubuntu)

Copyright (c) 2000, 2023, Oracle and/or its affiliates.

Oracle is a registered trademark of Oracle Corporation and/or its
affiliates. Other names may be trademarks of their respective
owners.

Type 'help;' or '\h' for help. Type '\c' to clear the current input statement.

mysql> show databases;
+--------------------+
| Database           |
+--------------------+
| EMPLOYEES          |
| employee           |
| information_schema |
| mysql              |
| performance_schema |
| sys                |
+--------------------+
6 rows in set (0.00 sec)

mysql> use employees
ERROR 1049 (42000): Unknown database 'employees'
mysql> use EMPLOYEES
Reading table information for completion of table and column names
You can turn off this feature to get a quicker startup with -A

Database changed
mysql> use employee
Database changed
mysql> show tables
    -> ;
Empty set (0.00 sec)

mysql> drop database employee ;
Query OK, 0 rows affected (0.02 sec)

mysql> show databases ;
+--------------------+
| Database           |
+--------------------+
| EMPLOYEES          |
| information_schema |
| mysql              |
| performance_schema |
| sys                |
+--------------------+
5 rows in set (0.00 sec)

mysql> use mysql;
Reading table information for completion of table and column names
You can turn off this feature to get a quicker startup with -A

Database changed
mysql> show tables
    -> ;
+------------------------------------------------------+
| Tables_in_mysql                                      |
+------------------------------------------------------+
| columns_priv                                         |
| component                                            |
| db                                                   |
| default_roles                                        |
| engine_cost                                          |
| func                                                 |
| general_log                                          |
| global_grants                                        |
| gtid_executed                                        |
| help_category                                        |
| help_keyword                                         |
| help_relation                                        |
| help_topic                                           |
| innodb_index_stats                                   |
| innodb_table_stats                                   |
| password_history                                     |
| plugin                                               |
| procs_priv                                           |
| proxies_priv                                         |
| replication_asynchronous_connection_failover         |
| replication_asynchronous_connection_failover_managed |
| replication_group_configuration_version              |
| replication_group_member_actions                     |
| role_edges                                           |
| server_cost                                          |
| servers                                              |
| slave_master_info                                    |
| slave_relay_log_info                                 |
| slave_worker_info                                    |
| slow_log                                             |
| tables_priv                                          |
| time_zone                                            |
| time_zone_leap_second                                |
| time_zone_name                                       |
| time_zone_transition                                 |
| time_zone_transition_type                            |
| user                                                 |
+------------------------------------------------------+
37 rows in set (0.00 sec)

mysql> select * in user ;
ERROR 1064 (42000): You have an error in your SQL syntax; check the manual that corresponds to your MySQL server version for the right syntax to use near 'in user' at line 1
mysql> show database;
ERROR 1064 (42000): You have an error in your SQL syntax; check the manual that corresponds to your MySQL server version for the right syntax to use near 'database' at line 1
mysql> show databases ;
+--------------------+
| Database           |
+--------------------+
| EMPLOYEES          |
| information_schema |
| mysql              |
| performance_schema |
| sys                |
+--------------------+
5 rows in set (0.01 sec)

mysql> use mysql ;
Database changed
mysql> update mysql.user set user = 'siri' where user = 'SIRI';
Query OK, 1 row affected (0.03 sec)
Rows matched: 1  Changed: 1  Warnings: 0

mysql> flush privileges ;
Query OK, 0 rows affected (0.01 sec)

mysql> use database mysql ;
ERROR 1049 (42000): Unknown database 'database'
mysql> use mysql ;
Database changed
mysql> show tables ;
+------------------------------------------------------+
| Tables_in_mysql                                      |
+------------------------------------------------------+
| columns_priv                                         |
| component                                            |
| db                                                   |
| default_roles                                        |
| engine_cost                                          |
| func                                                 |
| general_log                                          |
| global_grants                                        |
| gtid_executed                                        |
| help_category                                        |
| help_keyword                                         |
| help_relation                                        |
| help_topic                                           |
| innodb_index_stats                                   |
| innodb_table_stats                                   |
| password_history                                     |
| plugin                                               |
| procs_priv                                           |
| proxies_priv                                         |
| replication_asynchronous_connection_failover         |
| replication_asynchronous_connection_failover_managed |
| replication_group_configuration_version              |
| replication_group_member_actions                     |
| role_edges                                           |
| server_cost                                          |
| servers                                              |
| slave_master_info                                    |
| slave_relay_log_info                                 |
| slave_worker_info                                    |
| slow_log                                             |
| tables_priv                                          |
| time_zone                                            |
| time_zone_leap_second                                |
| time_zone_name                                       |
| time_zone_transition                                 |
| time_zone_transition_type                            |
| user                                                 |
+------------------------------------------------------+
37 rows in set (0.01 sec)

mysql> select * in user ;
ERROR 1064 (42000): You have an error in your SQL syntax; check the manual that corresponds to your MySQL server version for the right syntax to use near 'in user' at line 1
mysql> select * from user ;
+-----------+------------------+-------------+-------------+-------------+-------------+-------------+-----------+-------------+---------------+--------------+-----------+------------+-----------------+------------+------------+--------------+------------+-----------------------+------------------+--------------+-----------------+------------------+------------------+----------------+---------------------+--------------------+------------------+------------+--------------+------------------------+----------+------------------------+--------------------------+----------------------------+---------------+-------------+-----------------+----------------------+-----------------------+------------------------------------------------------------------------+------------------+-----------------------+-------------------+----------------+------------------+----------------+------------------------+---------------------+--------------------------+-----------------+
| Host      | User             | Select_priv | Insert_priv | Update_priv | Delete_priv | Create_priv | Drop_priv | Reload_priv | Shutdown_priv | Process_priv | File_priv | Grant_priv | References_priv | Index_priv | Alter_priv | Show_db_priv | Super_priv | Create_tmp_table_priv | Lock_tables_priv | Execute_priv | Repl_slave_priv | Repl_client_priv | Create_view_priv | Show_view_priv | Create_routine_priv | Alter_routine_priv | Create_user_priv | Event_priv | Trigger_priv | Create_tablespace_priv | ssl_type | ssl_cipher             | x509_issuer              | x509_subject               | max_questions | max_updates | max_connections | max_user_connections | plugin                | authentication_string                                                  | password_expired | password_last_changed | password_lifetime | account_locked | Create_role_priv | Drop_role_priv | Password_reuse_history | Password_reuse_time | Password_require_current | User_attributes |
+-----------+------------------+-------------+-------------+-------------+-------------+-------------+-----------+-------------+---------------+--------------+-----------+------------+-----------------+------------+------------+--------------+------------+-----------------------+------------------+--------------+-----------------+------------------+------------------+----------------+---------------------+--------------------+------------------+------------+--------------+------------------------+----------+------------------------+--------------------------+----------------------------+---------------+-------------+-----------------+----------------------+-----------------------+------------------------------------------------------------------------+------------------+-----------------------+-------------------+----------------+------------------+----------------+------------------------+---------------------+--------------------------+-----------------+
| localhost | debian-sys-maint | Y           | Y           | Y           | Y           | Y           | Y         | Y           | Y             | Y            | Y         | Y          | Y               | Y          | Y          | Y            | Y          | Y                     | Y                | Y            | Y               | Y                | Y                | Y              | Y                   | Y                  | Y                | Y          | Y            | Y                      |          | 0x                     | 0x                       | 0x                         |             0 |           0 |               0 |                    0 | caching_sha2_password | $A$005$D0Ok�2]r6
                                                                                                  s4u/:E2QAiGu3uHFWJ00Yv7kfEMVrKt154.rmloqO2DLGQw3 | N                | 2023-05-25 22:38:25   |              NULL | N              | Y                | Y              |                   NULL |                NULL | NULL                     | NULL            |
| localhost | mysql.infoschema | Y           | N           | N           | N           | N           | N         | N           | N             | N            | N         | N          | N               | N          | N          | N            | N          | N                     | N                | N            | N               | N                | N                | N              | N                   | N                  | N                | N          | N            | N                      |          | 0x                     | 0x                       | 0x                         |             0 |           0 |               0 |                    0 | caching_sha2_password | $A$005$THISISACOMBINATIONOFINVALIDSALTANDPASSWORDTHATMUSTNEVERBRBEUSED | N                | 2023-05-25 22:38:25   |              NULL | Y              | N                | N              |                   NULL |                NULL | NULL                     | NULL            |
| localhost | mysql.session    | N           | N           | N           | N           | N           | N         | N           | Y             | N            | N         | N          | N               | N          | N          | N            | Y          | N                     | N                | N            | N               | N                | N                | N              | N                   | N                  | N                | N          | N            | N                      |          | 0x                     | 0x                       | 0x                         |             0 |           0 |               0 |                    0 | caching_sha2_password | $A$005$THISISACOMBINATIONOFINVALIDSALTANDPASSWORDTHATMUSTNEVERBRBEUSED | N                | 2023-05-25 22:38:25   |              NULL | Y              | N                | N              |                   NULL |                NULL | NULL                     | NULL            |
| localhost | mysql.sys        | N           | N           | N           | N           | N           | N         | N           | N             | N            | N         | N          | N               | N          | N          | N            | N          | N                     | N                | N            | N               | N                | N                | N              | N                   | N                  | N                | N          | N            | N                      |          | 0x                     | 0x                       | 0x                         |             0 |           0 |               0 |                    0 | caching_sha2_password | $A$005$THISISACOMBINATIONOFINVALIDSALTANDPASSWORDTHATMUSTNEVERBRBEUSED | N                | 2023-05-25 22:38:25   |              NULL | Y              | N                | N              |                   NULL |                NULL | NULL                     | NULL            |
| localhost | root             | Y           | Y           | Y           | Y           | Y           | Y         | Y           | Y             | Y            | Y         | Y          | Y               | Y          | Y          | Y            | Y          | Y                     | Y                | Y            | Y               | Y                | Y                | Y              | Y                   | Y                  | Y                | Y          | Y            | Y                      |          | 0x                     | 0x                       | 0x                         |             0 |           0 |               0 |                    0 | auth_socket           |                                                                        | N                | 2023-05-25 22:38:25   |              NULL | N              | Y                | Y              |                   NULL |                NULL | NULL                     | NULL            |
| localhost | siri             | N           | N           | N           | N           | N           | N         | N           | N             | N            | N         | N          | N               | N          | N          | N            | N          | N                     | N                | N            | N               | N                | N                | N              | N                   | N                  | N                | N          | N            | N                      |          | 0x                     | 0x                       | 0x                         |             0 |           0 |               0 |                    0 | caching_sha2_password | $A$005$b&QW:BL>Gsw>ox6YpyERZmIZy8nxsDizWkKu5Xs1Jcr1GOua4IhuITOA3 | N                | 2023-05-29 22:22:22   |              NULL | N              | N                | N              |                   NULL |                NULL | NULL                     | NULL            |
+-----------+------------------+-------------+-------------+-------------+-------------+-------------+-----------+-------------+---------------+--------------+-----------+------------+-----------------+------------+------------+--------------+------------+-----------------------+------------------+--------------+-----------------+------------------+------------------+----------------+---------------------+--------------------+------------------+------------+--------------+------------------------+----------+------------------------+--------------------------+----------------------------+---------------+-------------+-----------------+----------------------+-----------------------+------------------------------------------------------------------------+------------------+-----------------------+-------------------+----------------+------------------+----------------+------------------------+---------------------+--------------------------+-----------------+
6 rows in set (0.00 sec)

mysql> show tables;
+------------------------------------------------------+
| Tables_in_mysql                                      |
+------------------------------------------------------+
| columns_priv                                         |
| component                                            |
| db                                                   |
| default_roles                                        |
| engine_cost                                          |
| func                                                 |
| general_log                                          |
| global_grants                                        |
| gtid_executed                                        |
| help_category                                        |
| help_keyword                                         |
| help_relation                                        |
| help_topic                                           |
| innodb_index_stats                                   |
| innodb_table_stats                                   |
| password_history                                     |
| plugin                                               |
| procs_priv                                           |
| proxies_priv                                         |
| replication_asynchronous_connection_failover         |
| replication_asynchronous_connection_failover_managed |
| replication_group_configuration_version              |
| replication_group_member_actions                     |
| role_edges                                           |
| server_cost                                          |
| servers                                              |
| slave_master_info                                    |
| slave_relay_log_info                                 |
| slave_worker_info                                    |
| slow_log                                             |
| tables_priv                                          |
| time_zone                                            |
| time_zone_leap_second                                |
| time_zone_name                                       |
| time_zone_transition                                 |
| time_zone_transition_type                            |
| user                                                 |
+------------------------------------------------------+
37 rows in set (0.00 sec)

mysql> select user from mysql.user where user = siri
    -> ;
ERROR 1054 (42S22): Unknown column 'siri' in 'where clause'
mysql> SELECT user FROM mysql.user WHERE user = 'new_username';
Empty set (0.00 sec)

mysql> SELECT user FROM mysql.user WHERE user = 'siri';
+------+
| user |
+------+
| siri |
+------+
1 row in set (0.00 sec)

mysql> select * from siri ;
ERROR 1146 (42S02): Table 'mysql.siri' doesn't exist
mysql> 


